{
  "path": "/products/",
  "releaseSeq": 1,
  "kind": "collection",
  "language": "en",
  "title": "Products",
  "resource": {
    "items": [
      {
        "date": null,
        "summary": "A 400 W monocrystalline panel.",
        "title": "Panel 400 W",
        "url": "/products/panel-400/"
      }
    ],
    "page": 1,
    "pages": 1
  },
  "capabilities": [
    "check_availability",
    "get_quote",
    "place_order",
    "search_site"
  ],
  "jsonLd": {
    "@context": "https://schema.org",
    "@type": "CollectionPage",
    "inLanguage": "en",
    "name": "Products",
    "url": "https://example.com/products/"
  },
  "markdown": "https://example.com/products/index.md"
}
