{
  "path": "/sw/",
  "releaseSeq": 1,
  "kind": "page",
  "language": "sw",
  "title": "Example Solar",
  "resource": {
    "id": "pages/index/sw",
    "summary": "Paneli za jua kwa nyumba na biashara ndogo.",
    "title": "Example Solar",
    "url": "https://example.com/sw/"
  },
  "capabilities": [
    "search_site"
  ],
  "jsonLd": {
    "@context": "https://schema.org",
    "@type": "WebSite",
    "description": "Solar panels and installation in Nairobi.",
    "inLanguage": "sw",
    "mainEntityOfPage": {
      "@type": "WebPage",
      "inLanguage": "sw",
      "name": "Example Solar",
      "url": "https://example.com/sw/"
    },
    "name": "Example Solar",
    "url": "https://example.com/"
  },
  "markdown": "https://example.com/sw/index.md"
}
